{
  "version": "0.1",
  "run_id": "20261023T195910-3b5043",
  "pregunta": "¿Vale la pena pelear la disputa du_1jmfZda6WdIoKx?",
  "modo": "real",
  "estado": "concluida",
  "conclusion": "Sí, vale la pena pelear la disputa du_1jmfZda6WdIoKx de 145.28 dólares porque la entrega fue confirmada con prueba de entrega, el cliente no había reclamado antes y no hay señales de fraude.",
  "hipotesis": [
    {
      "id": "H1",
      "enunciado": "Vale la pena pelear porque la entrega fue confirmada con prueba de entrega, el cliente no había reclamado antes y no hay señales de fraude.",
      "veredicto": "sostenida",
      "razon": "La entrega fue confirmada con una prueba de entrega (firma), el cliente no había hecho un reclamo previo sobre este pedido y no se detectaron señales de fraude.",
      "evidencia": [
        "E1"
      ]
    },
    {
      "id": "H2",
      "enunciado": "No vale la pena pelear porque hay sospecha de fraude en este caso.",
      "veredicto": "descartada",
      "razon": "No hay señales de fraude y el cliente no está bajo sospecha de fraude.",
      "evidencia": [
        "E1"
      ]
    },
    {
      "id": "H3",
      "enunciado": "No vale la pena pelear porque el pedido no llegó o no hay prueba de entrega.",
      "veredicto": "descartada",
      "razon": "La entrega fue confirmada y existe una prueba de entrega, por lo que el pedido sí llegó.",
      "evidencia": [
        "E1"
      ]
    }
  ],
  "evidencia": [
    {
      "id": "E1",
      "sql": "SELECT monto, entrega_confirmada, senales_fraude, sospecha_fraude, causa_operativa, razon_decision, reclamo_previo, estado, prueba_entrega, tipo_destino, nivel_riesgo, pais_facturacion, pais_ip FROM canonico.disputas WHERE disputa_id = 'du_1jmfZda6WdIoKx';",
      "motor": "duckdb",
      "ok": true,
      "filas": [
        {
          "monto": 145.28,
          "entrega_confirmada": true,
          "senales_fraude": 0,
          "sospecha_fraude": false,
          "causa_operativa": false,
          "razon_decision": "entrega_confirmada_sin_reclamo",
          "reclamo_previo": false,
          "estado": "needs_response",
          "prueba_entrega": "firma",
          "tipo_destino": "domicilio",
          "nivel_riesgo": "normal",
          "pais_facturacion": "CO",
          "pais_ip": "CO"
        }
      ],
      "n_filas": 1,
      "error": null
    },
    {
      "id": "E2",
      "sql": "SELECT disputa_id, pedido_id, cliente_id, motivo, estado, monto, abierta_en, vence_en, transportista, region, estado_envio, prueba_entrega, entregado_en, entrega_confirmada, reclamo_previo, pedidos_previos, disputas_previas, senales_fraude, vale_pelear, razon_decision FROM canonico.disputas WHERE disputa_id IN ('du_1jmfZda6WdIoKx') ORDER BY disputa_id",
      "motor": "duckdb",
      "ok": true,
      "filas": [
        {
          "disputa_id": "du_1jmfZda6WdIoKx",
          "pedido_id": "ORD-1722",
          "cliente_id": "cus_zYuJS4TSV54Vmo",
          "motivo": "fraudulent",
          "estado": "needs_response",
          "monto": 145.28,
          "abierta_en": "2026-09-25 15:00:00",
          "vence_en": "2026-10-09 23:00:00",
          "transportista": "RapidEnvio",
          "region": "Sur",
          "estado_envio": "entregado",
          "prueba_entrega": "firma",
          "entregado_en": "2026-09-23",
          "entrega_confirmada": true,
          "reclamo_previo": false,
          "pedidos_previos": 1,
          "disputas_previas": 0,
          "senales_fraude": 0,
          "vale_pelear": true,
          "razon_decision": "entrega_confirmada_sin_reclamo"
        }
      ],
      "n_filas": 1,
      "error": null
    },
    {
      "id": "E3",
      "sql": "SELECT pedido_id, creado_en, categoria, texto FROM canonico.mensajes_soporte WHERE pedido_id IN ('ORD-1722') ORDER BY pedido_id, creado_en",
      "motor": "duckdb",
      "ok": true,
      "filas": [],
      "n_filas": 0,
      "error": null
    }
  ],
  "recomendacion": "Pelear esta disputa con la prueba de entrega y el historial del cliente. De las 1 disputas del grupo, 1 se debe pelear.",
  "abstencion": null,
  "aprobacion": {
    "item_id": "AP-20261023T195910-3b5043",
    "estado": "aprobada"
  },
  "cola": [
    {
      "item_id": "AP-20261023T195910-3b5043-1",
      "tipo": "respuesta_banco",
      "disputa_id": "du_1jmfZda6WdIoKx",
      "estado": "aprobada",
      "motivo": "cumple las 5 reglas de la política: queda lista para que una persona la envíe",
      "borrador": "Respuesta a la disputa du_1jmfZda6WdIoKx · el titular dice no haber hecho la compra · 145.28 USD · abierta el 2026-09-25 · vence el 2026-10-09\n\nSolicitamos que se mantenga el cargo. Evidencia:\n- Entrega: el pedido ORD-1722 se entregó el 2026-09-23 con RapidEnvio (Sur), con firma de quien recibió. [E2]\n- Historial del cliente: 1 pedido anterior y ninguna disputa previa. [E2]\n- Soporte: el cliente no escribió a soporte sobre este pedido. [E3]\n- Señales de fraude: 0 de 4 (cliente nuevo, riesgo alto, país de la IP distinto, punto de retiro). [E2]\n\nAdjuntar: comprobante de entrega (firma de quien recibió) y el historial de comunicaciones con el cliente.\nBorrador preparado por IO con datos de io-engine. Lo revisa y lo envía una persona."
    }
  ],
  "metricas": {
    "iteraciones": 2,
    "consultas": 3,
    "ms": 99976.9,
    "tokens": 12896,
    "costo_usd": 0.0,
    "devoluciones": 1,
    "memorias_usadas": 5,
    "entidades_ancladas": 1,
    "capa_semantica": "on"
  },
  "informe_md": "# Informe de IO · 20261023T195910-3b5043\n\n## La pregunta\n\n> ¿Vale la pena pelear la disputa du_1jmfZda6WdIoKx?\n\n## Lo que encontramos\n\nSí, vale la pena pelear la disputa du_1jmfZda6WdIoKx de 145.28 dólares porque la entrega fue confirmada con prueba de entrega, el cliente no había reclamado antes y no hay señales de fraude.\n\n- **Vale la pena pelear porque la entrega fue confirmada con prueba de entrega, el cliente no había reclamado antes y no hay señales de fraude.** — La entrega fue confirmada con una prueba de entrega (firma), el cliente no había hecho un reclamo previo sobre este pedido y no se detectaron señales de fraude. (evidencia: E1)\n\n## Hipótesis descartadas\n\n- ~~No vale la pena pelear porque hay sospecha de fraude en este caso.~~ — No hay señales de fraude y el cliente no está bajo sospecha de fraude. (evidencia: E1)\n- ~~No vale la pena pelear porque el pedido no llegó o no hay prueba de entrega.~~ — La entrega fue confirmada y existe una prueba de entrega, por lo que el pedido sí llegó. (evidencia: E1)\n\n## Evidencia\n\n**E1** · motor: duckdb\n\n```sql\nSELECT monto, entrega_confirmada, senales_fraude, sospecha_fraude, causa_operativa, razon_decision, reclamo_previo, estado, prueba_entrega, tipo_destino, nivel_riesgo, pais_facturacion, pais_ip FROM canonico.disputas WHERE disputa_id = 'du_1jmfZda6WdIoKx';\n```\n\n| monto | entrega_confirmada | senales_fraude | sospecha_fraude | causa_operativa | razon_decision | reclamo_previo | estado | prueba_entrega | tipo_destino | nivel_riesgo | pais_facturacion | pais_ip |\n| --- | --- | --- | --- | --- | --- | --- | --- | --- | --- | --- | --- | --- |\n| 145.28 | True | 0 | False | False | entrega_confirmada_sin_reclamo | False | needs_response | firma | domicilio | normal | CO | CO |\n\n**E2** · motor: duckdb\n\n```sql\nSELECT disputa_id, pedido_id, cliente_id, motivo, estado, monto, abierta_en, vence_en, transportista, region, estado_envio, prueba_entrega, entregado_en, entrega_confirmada, reclamo_previo, pedidos_previos, disputas_previas, senales_fraude, vale_pelear, razon_decision FROM canonico.disputas WHERE disputa_id IN ('du_1jmfZda6WdIoKx') ORDER BY disputa_id\n```\n\n| disputa_id | pedido_id | cliente_id | motivo | estado | monto | abierta_en | vence_en | transportista | region | estado_envio | prueba_entrega | entregado_en | entrega_confirmada | reclamo_previo | pedidos_previos | disputas_previas | senales_fraude | vale_pelear | razon_decision |\n| --- | --- | --- | --- | --- | --- | --- | --- | --- | --- | --- | --- | --- | --- | --- | --- | --- | --- | --- | --- |\n| du_1jmfZda6WdIoKx | ORD-1722 | cus_zYuJS4TSV54Vmo | fraudulent | needs_response | 145.28 | 2026-09-25 15:00:00 | 2026-10-09 23:00:00 | RapidEnvio | Sur | entregado | firma | 2026-09-23 | True | False | 1 | 0 | 0 | True | entrega_confirmada_sin_reclamo |\n\n**E3** · motor: duckdb\n\n```sql\nSELECT pedido_id, creado_en, categoria, texto FROM canonico.mensajes_soporte WHERE pedido_id IN ('ORD-1722') ORDER BY pedido_id, creado_en\n```\n\n_(sin filas)_\n\n\n## Qué conviene hacer\n\nPelear esta disputa con la prueba de entrega y el historial del cliente. De las 1 disputas del grupo, 1 se debe pelear.\n\n### Cola de aprobación\n\nIO prepara y no envía nada: una regla de política aprueba o rechaza cada entrada, y lo aprobado lo revisa y lo envía una persona.\n\n**Respuesta al banco · du_1jmfZda6WdIoKx** · ✅ aprobada · `AP-20261023T195910-3b5043-1`\n\n_Política: cumple las 5 reglas de la política: queda lista para que una persona la envíe_\n\n> Respuesta a la disputa du_1jmfZda6WdIoKx · el titular dice no haber hecho la compra · 145.28 USD · abierta el 2026-09-25 · vence el 2026-10-09\n>\n> Solicitamos que se mantenga el cargo. Evidencia:\n> - Entrega: el pedido ORD-1722 se entregó el 2026-09-23 con RapidEnvio (Sur), con firma de quien recibió. [E2]\n> - Historial del cliente: 1 pedido anterior y ninguna disputa previa. [E2]\n> - Soporte: el cliente no escribió a soporte sobre este pedido. [E3]\n> - Señales de fraude: 0 de 4 (cliente nuevo, riesgo alto, país de la IP distinto, punto de retiro). [E2]\n>\n> Adjuntar: comprobante de entrega (firma de quien recibió) y el historial de comunicaciones con el cliente.\n> Borrador preparado por IO con datos de io-engine. Lo revisa y lo envía una persona.\n\n---\nAprobación: **aprobada** · modo real · consultas: 3 · 99977 ms\n"
}