{
  "version": "0.1",
  "run_id": "20261023T210610-a9fdf5",
  "pregunta": "¿Vale la pena pelear la disputa du_KntafjWlp0S39V?",
  "modo": "real",
  "estado": "concluida",
  "conclusion": "No, no vale la pena pelear la disputa du_KntafjWlp0S39V de 160.10 dólares porque hay sospecha de fraude, aunque la entrega fue confirmada con foto. De las 1 disputas analizadas, 1 se clasifica como sospecha de fraude y no se debe pelear.",
  "hipotesis": [
    {
      "id": "H1",
      "enunciado": "Vale la pena pelear la disputa porque la entrega fue confirmada con una prueba de entrega y el cliente no había reclamado antes.",
      "veredicto": "descartada",
      "razon": "Aunque la entrega fue confirmada con foto y el cliente no había reclamado antes, la disputa presenta 3 señales de fraude, por lo que hay sospecha de fraude y no vale la pena pelear.",
      "evidencia": [
        "E1"
      ]
    },
    {
      "id": "H2",
      "enunciado": "No vale la pena pelear la disputa porque hay sospecha de fraude en este caso.",
      "veredicto": "sostenida",
      "razon": "La disputa tiene 3 señales de fraude: el cliente no tiene pedidos previos, el país de la IP es distinto al país de facturación y el envío fue a un punto de retiro. Con 3 señales hay sospecha de fraude, por lo que la decisión registrada es no pelear.",
      "evidencia": [
        "E1"
      ]
    }
  ],
  "evidencia": [
    {
      "id": "E1",
      "sql": "SELECT disputa_id, motivo, monto, estado, estado_envio, prueba_entrega, entrega_confirmada, reclamo_previo, senales_fraude, sospecha_fraude, causa_operativa, vale_pelear, decision, razon_decision, entregado_en, prometido_en, extraviado, pedidos_previos, nivel_riesgo, pais_facturacion, pais_ip, tipo_destino FROM canonico.disputas WHERE disputa_id = 'du_KntafjWlp0S39V';",
      "motor": "duckdb",
      "ok": true,
      "filas": [
        {
          "disputa_id": "du_KntafjWlp0S39V",
          "motivo": "fraudulent",
          "monto": 160.1,
          "estado": "won",
          "estado_envio": "entregado",
          "prueba_entrega": "foto",
          "entrega_confirmada": true,
          "reclamo_previo": false,
          "senales_fraude": 3,
          "sospecha_fraude": true,
          "causa_operativa": false,
          "vale_pelear": false,
          "decision": "no_pelear",
          "razon_decision": "sospecha_de_fraude",
          "entregado_en": "2026-07-06",
          "prometido_en": "2026-07-06",
          "extraviado": false,
          "pedidos_previos": 0,
          "nivel_riesgo": "normal",
          "pais_facturacion": "CO",
          "pais_ip": "MX",
          "tipo_destino": "punto_retiro"
        }
      ],
      "n_filas": 1,
      "error": null
    },
    {
      "id": "E2",
      "sql": "SELECT disputa_id, pedido_id, cliente_id, motivo, estado, monto, abierta_en, vence_en, transportista, region, estado_envio, prueba_entrega, entregado_en, entrega_confirmada, reclamo_previo, pedidos_previos, disputas_previas, senales_fraude, vale_pelear, razon_decision FROM canonico.disputas WHERE disputa_id IN ('du_KntafjWlp0S39V') ORDER BY disputa_id",
      "motor": "duckdb",
      "ok": true,
      "filas": [
        {
          "disputa_id": "du_KntafjWlp0S39V",
          "pedido_id": "ORD-1001",
          "cliente_id": "cus_NHZ6rP7FZvynAA",
          "motivo": "fraudulent",
          "estado": "won",
          "monto": 160.1,
          "abierta_en": "2026-07-19 15:00:00",
          "vence_en": "2026-08-02 23:00:00",
          "transportista": "CargoSur",
          "region": "Centro",
          "estado_envio": "entregado",
          "prueba_entrega": "foto",
          "entregado_en": "2026-07-06",
          "entrega_confirmada": true,
          "reclamo_previo": false,
          "pedidos_previos": 0,
          "disputas_previas": 0,
          "senales_fraude": 3,
          "vale_pelear": false,
          "razon_decision": "sospecha_de_fraude"
        }
      ],
      "n_filas": 1,
      "error": null
    }
  ],
  "recomendacion": "No pelear esta disputa; aceptarla y marcar al cliente por posible fraude. De las 1 disputas analizadas, 1 corresponde a sospecha de fraude y no se pelea.",
  "abstencion": null,
  "aprobacion": {
    "item_id": "AP-20261023T210610-a9fdf5",
    "estado": "aprobada"
  },
  "cola": [
    {
      "item_id": "AP-20261023T210610-a9fdf5-1",
      "tipo": "no_pelear",
      "disputa_id": "du_KntafjWlp0S39V",
      "estado": "aprobada",
      "motivo": "no se envía al banco: es el plan para la dueña, con su evidencia",
      "borrador": "Disputa du_KntafjWlp0S39V · 160.10 USD: no conviene pelearla porque hay 2 o más señales de fraude. Qué hacer: no pelear: aceptar la disputa y marcar al cliente. [E2]"
    }
  ],
  "metricas": {
    "iteraciones": 2,
    "consultas": 2,
    "ms": 68127.8,
    "tokens": 13647,
    "costo_usd": 0.0,
    "devoluciones": 0,
    "memorias_usadas": 5,
    "entidades_ancladas": 1,
    "capa_semantica": "on"
  },
  "informe_md": "# Informe de IO · 20261023T210610-a9fdf5\n\n## La pregunta\n\n> ¿Vale la pena pelear la disputa du_KntafjWlp0S39V?\n\n## Lo que encontramos\n\nNo, no vale la pena pelear la disputa du_KntafjWlp0S39V de 160.10 dólares porque hay sospecha de fraude, aunque la entrega fue confirmada con foto. De las 1 disputas analizadas, 1 se clasifica como sospecha de fraude y no se debe pelear.\n\n- **No vale la pena pelear la disputa porque hay sospecha de fraude en este caso.** — La disputa tiene 3 señales de fraude: el cliente no tiene pedidos previos, el país de la IP es distinto al país de facturación y el envío fue a un punto de retiro. Con 3 señales hay sospecha de fraude, por lo que la decisión registrada es no pelear. (evidencia: E1)\n\n## Hipótesis descartadas\n\n- ~~Vale la pena pelear la disputa porque la entrega fue confirmada con una prueba de entrega y el cliente no había reclamado antes.~~ — Aunque la entrega fue confirmada con foto y el cliente no había reclamado antes, la disputa presenta 3 señales de fraude, por lo que hay sospecha de fraude y no vale la pena pelear. (evidencia: E1)\n\n## Evidencia\n\n**E1** · motor: duckdb\n\n```sql\nSELECT disputa_id, motivo, monto, estado, estado_envio, prueba_entrega, entrega_confirmada, reclamo_previo, senales_fraude, sospecha_fraude, causa_operativa, vale_pelear, decision, razon_decision, entregado_en, prometido_en, extraviado, pedidos_previos, nivel_riesgo, pais_facturacion, pais_ip, tipo_destino FROM canonico.disputas WHERE disputa_id = 'du_KntafjWlp0S39V';\n```\n\n| disputa_id | motivo | monto | estado | estado_envio | prueba_entrega | entrega_confirmada | reclamo_previo | senales_fraude | sospecha_fraude | causa_operativa | vale_pelear | decision | razon_decision | entregado_en | prometido_en | extraviado | pedidos_previos | nivel_riesgo | pais_facturacion | pais_ip | tipo_destino |\n| --- | --- | --- | --- | --- | --- | --- | --- | --- | --- | --- | --- | --- | --- | --- | --- | --- | --- | --- | --- | --- | --- |\n| du_KntafjWlp0S39V | fraudulent | 160.1 | won | entregado | foto | True | False | 3 | True | False | False | no_pelear | sospecha_de_fraude | 2026-07-06 | 2026-07-06 | False | 0 | normal | CO | MX | punto_retiro |\n\n**E2** · motor: duckdb\n\n```sql\nSELECT disputa_id, pedido_id, cliente_id, motivo, estado, monto, abierta_en, vence_en, transportista, region, estado_envio, prueba_entrega, entregado_en, entrega_confirmada, reclamo_previo, pedidos_previos, disputas_previas, senales_fraude, vale_pelear, razon_decision FROM canonico.disputas WHERE disputa_id IN ('du_KntafjWlp0S39V') ORDER BY disputa_id\n```\n\n| disputa_id | pedido_id | cliente_id | motivo | estado | monto | abierta_en | vence_en | transportista | region | estado_envio | prueba_entrega | entregado_en | entrega_confirmada | reclamo_previo | pedidos_previos | disputas_previas | senales_fraude | vale_pelear | razon_decision |\n| --- | --- | --- | --- | --- | --- | --- | --- | --- | --- | --- | --- | --- | --- | --- | --- | --- | --- | --- | --- |\n| du_KntafjWlp0S39V | ORD-1001 | cus_NHZ6rP7FZvynAA | fraudulent | won | 160.1 | 2026-07-19 15:00:00 | 2026-08-02 23:00:00 | CargoSur | Centro | entregado | foto | 2026-07-06 | True | False | 0 | 0 | 3 | False | sospecha_de_fraude |\n\n\n## Qué conviene hacer\n\nNo pelear esta disputa; aceptarla y marcar al cliente por posible fraude. De las 1 disputas analizadas, 1 corresponde a sospecha de fraude y no se pelea.\n\n### Cola de aprobación\n\nIO prepara y no envía nada: una regla de política aprueba o rechaza cada entrada, y lo aprobado lo revisa y lo envía una persona.\n\n**No pelear · du_KntafjWlp0S39V** · ✅ aprobada · `AP-20261023T210610-a9fdf5-1`\n\n_Política: no se envía al banco: es el plan para la dueña, con su evidencia_\n\n> Disputa du_KntafjWlp0S39V · 160.10 USD: no conviene pelearla porque hay 2 o más señales de fraude. Qué hacer: no pelear: aceptar la disputa y marcar al cliente. [E2]\n\n---\nAprobación: **aprobada** · modo real · consultas: 2 · 68128 ms\n"
}